### ISSUE TITLE
Reduce MTU on all batXX devices

### ISSUE THREAD

**Issue by lemoer** [freifunkh/ansible#80]
Auch wenn wir die MTU auf den fastd interfaces begrenzen, weiß der TCP-Layer auf höheren nicht inhärent davon, da batman das ganze für die höheren Layer wieder transparent macht. Normal nutzen wir da Clamping auf die Path MTU.

Leider klappt das ganze nicht, wenn unsere MTU auf den batXX devices zu groß ist:

```
root@FFH-Burg-LTE:~# tcpdump -n -i br-wan
01:29:13.408378 IP 185.197.132.140.10018 > 192.168.8.101.49374: UDP, length 820
01:29:13.408439 IP 185.197.132.140.10018 > 192.168.8.101.49374: UDP, length 820
01:29:13.408518 IP 185.197.132.140.10018 > 192.168.8.101.49374: UDP, length 820
01:29:13.408585 IP 185.197.132.140.10018 > 192.168.8.101.49374: UDP, length 820
01:29:13.408658 IP 185.197.132.140.10018 > 192.168.8.101.49374: UDP, length 820
01:29:13.408765 IP 185.197.132.140.10018 > 192.168.8.101.49374: UDP, length 820
01:29:13.408813 IP 185.197.132.140.10018 > 192.168.8.101.49374: UDP, length 820
01:29:13.408881 IP 185.197.132.140.10018 > 192.168.8.101.49374: UDP, length 820
01:29:13.408949 IP 185.197.132.140.10018 > 192.168.8.101.49374: UDP, length 820
01:29:13.409021 IP 185.197.132.140.10018 > 192.168.8.101.49374: UDP, length 820
01:29:13.409095 IP 185.197.132.140.10018 > 192.168.8.101.49374: UDP, length 820
01:29:13.409167 IP 185.197.132.140.10018 > 192.168.8.101.49374: UDP, length 820
01:29:13.409240 IP 185.197.132.140.10018 > 192.168.8.101.49374: UDP, length 820
```

Wenn ich nun auf dem Supernode folgendes ausführe `ip link set mtu 1362 dev bat18`:

```
01:30:30.790167 IP 185.197.132.140.10018 > 192.168.8.101.49374: UDP, length 1424
01:30:30.790285 IP 185.197.132.140.10018 > 192.168.8.101.49374: UDP, length 1424
01:30:30.792173 IP 192.168.8.101.49374 > 185.197.132.140.10018: UDP, length 151
01:30:30.792774 IP 192.168.8.101.49374 > 185.197.132.140.10018: UDP, length 114
01:30:30.798168 IP 185.197.132.140.10018 > 192.168.8.101.49374: UDP, length 1424
01:30:30.798282 IP 185.197.132.140.10018 > 192.168.8.101.49374: UDP, length 1424
01:30:30.799151 IP 185.197.132.140.10018 > 192.168.8.101.49374: UDP, length 1424
01:30:30.799264 IP 185.197.132.140.10018 > 192.168.8.101.49374: UDP, length 1424
01:30:30.802419 IP 192.168.8.101.49374 > 185.197.132.140.10018: UDP, length 114
01:30:30.810157 IP 185.197.132.140.10018 > 192.168.8.101.49374: UDP, length 1424
01:30:30.810270 IP 185.197.132.140.10018 > 192.168.8.101.49374: UDP, length 1424
01:30:30.811113 IP 185.197.132.140.10018 > 192.168.8.101.49374: UDP, length 1424
01:30:30.812167 IP 185.197.132.140.10018 > 192.168.8.101.49374: UDP, length 1424
01:30:30.812281 IP 185.197.132.140.10018 > 192.168.8.101.49374: UDP, length 1424
```
-> keine Fragmentierung mehr!

Im Speedtest bringt das bei mir hier gerade etwa +50% Speed. Das mag aber von Anschluss zu Anschluss unterschiedlich sein.

Die MTU sollte so korrekt berechnet sein: 1362 = 1394 - 32 (siehe hier, "usable client mtu": [Link](https://gluon.readthedocs.io/en/latest/user/faq.html#what-is-a-good-mtu-on-the-mesh-vpn)). Wir sollten also auf allen Bat-Devices die MTU 1362 ausrollen.

**Comment by lemoer** [comment]
Hmmm. Ok es schaut so aus, als ob das auf diese Weise doch keine gute Idee wäre, weil viele (ahnungslose) ISPs in der Welt die "ICMP-Packet too big"-Pakete aussperren.

Wir können das also nur darüber fixen indem wir die MSS auf einen festen Wert setzen. In der MSS sind noch IP und TCP-Header enthalten. Die MSS ist also nochmal 40 bytes (IPv4) bzw 60 bytes (IPv6) kleiner als die MTU.

IPv4:
```
outerface eth0 proto tcp tcp-flags (SYN RST) SYN TCPMSS set-mss 1320;
```

IPv6:
```
outerface eth0 proto tcp tcp-flags (SYN RST) SYN TCPMSS set-mss 1300;
```

**Comment by 1977er** [comment]
Könnte man argumentieren, dass sie zumindest bei IPv6 sich sowieso in den Fuß schießen, wenn sie das tun?

**Comment by lemoer** [comment]
Joa, könnte man. Dann müsste man in der Firewall sowas wie eine MTU nachbauen. Da das dann nur bei UDP hilft, bin ich nicht sicher ob das zielführend ist. Quic wäre wohl positiv beeinflusst. Ansonsten haben wir (glaube ich) nicht so viel UDP-Traffic.

Für IPerf kann man wohl die MSS explizit via `-M MSS` setzen. Müssen wir mal gucken ob das auf der Serverseite geht. Ggf. könnten wir es auch bei dem ffh_speedtest.sh-Skript mit einbauen. Ggf. ist die Option aber auch komplett broken: https://github.com/esnet/iperf/issues/779



-- 
Diese Nachricht wurde von meinem Android-Gerät mit K-9 Mail gesendet.

**Comment by lemoer** [comment]
For doc purposes, to test if any packet size is causing errors.
``` shell
for mtu in $(seq 1300 1500); do printf "%d: " "$mtu"; ping6 -M do -s $((mtu-48)) -c 1 fdca:ffee:8:
:7001 2>&1 | grep loss; done
1300: 1 packets transmitted, 1 received, 0% packet loss, time 0ms
1301: 1 packets transmitted, 0 received, +1 errors, 100% packet loss, time 0ms
1302: 1 packets transmitted, 0 received, +1 errors, 100% packet loss, time 0ms
1303: 1 packets transmitted, 0 received, +1 errors, 100% packet loss, time 0ms
...
```

**Comment by CodeFetch** [comment]
Duplicate of #64
